[
  {
    "sample_id": "SYNTHETIC-01:SYN_A:business_financials",
    "article_id": "SYNTHETIC-01",
    "event_cluster_id": "SYNTHETIC-E01",
    "source": "SYNTHETIC_ONLY",
    "source_url": null,
    "source_revision": "synthetic-v1",
    "source_row_id": "1",
    "license_ref": "SYNTHETIC-invented-not-rights-evidence",
    "article_sha256": "92ae622fe5b8fe89049cc61b2612724ea602c552dc71d30d07ca78aab44c78ab",
    "published_at": null,
    "first_seen_at": null,
    "ticker": "SYN_A",
    "company_name": "Công ty Giả Lập A",
    "identity_ref": "SYNTHETIC-fictional-not-issuer-evidence",
    "target_evidence": "Công ty Giả Lập A",
    "context": "Công ty Giả Lập A báo lợi nhuận tăng 20% so với cùng kỳ.",
    "aspect": "business_financials",
    "aspect_present": true,
    "sentiment": "positive",
    "evidence": "lợi nhuận tăng 20% so với cùng kỳ",
    "annotation_status": "verified",
    "review_reason": "",
    "annotator_id": "SYNTHETIC-adjudicator",
    "label_origin": "human",
    "guideline_version": "gold-pilot-v1",
    "dataset_version": "SYNTHETIC-NOT-GOLD-v1",
    "is_synthetic": true,
    "split": "quarantine",
    "review_ids": [
      "SYNTHETIC-review-1-a",
      "SYNTHETIC-review-1-b"
    ],
    "adjudication_id": "SYNTHETIC-decision-1"
  },
  {
    "sample_id": "SYNTHETIC-02:SYN_A:business_financials",
    "article_id": "SYNTHETIC-02",
    "event_cluster_id": "SYNTHETIC-E02",
    "source": "SYNTHETIC_ONLY",
    "source_url": null,
    "source_revision": "synthetic-v1",
    "source_row_id": "2",
    "license_ref": "SYNTHETIC-invented-not-rights-evidence",
    "article_sha256": "5f6f2b6346f9abd73fb4780d97dda62a6e52fab5bf5e8bff5efa270b89ecaee7",
    "published_at": null,
    "first_seen_at": null,
    "ticker": "SYN_A",
    "company_name": "Công ty Giả Lập A",
    "identity_ref": "SYNTHETIC-fictional-not-issuer-evidence",
    "target_evidence": "Công ty Giả Lập A",
    "context": "Công ty Giả Lập A có doanh thu giảm 15% so với cùng kỳ.",
    "aspect": "business_financials",
    "aspect_present": true,
    "sentiment": "negative",
    "evidence": "doanh thu giảm 15% so với cùng kỳ",
    "annotation_status": "verified",
    "review_reason": "",
    "annotator_id": "SYNTHETIC-adjudicator",
    "label_origin": "human",
    "guideline_version": "gold-pilot-v1",
    "dataset_version": "SYNTHETIC-NOT-GOLD-v1",
    "is_synthetic": true,
    "split": "quarantine",
    "review_ids": [
      "SYNTHETIC-review-2-a",
      "SYNTHETIC-review-2-b"
    ],
    "adjudication_id": "SYNTHETIC-decision-2"
  },
  {
    "sample_id": "SYNTHETIC-03:SYN_A:leadership_insider",
    "article_id": "SYNTHETIC-03",
    "event_cluster_id": "SYNTHETIC-E03",
    "source": "SYNTHETIC_ONLY",
    "source_url": null,
    "source_revision": "synthetic-v1",
    "source_row_id": "3",
    "license_ref": "SYNTHETIC-invented-not-rights-evidence",
    "article_sha256": "4a8e053dc3a365c259e0965996ab3998d8f9107403596c09bca2238841737741",
    "published_at": null,
    "first_seen_at": null,
    "ticker": "SYN_A",
    "company_name": "Công ty Giả Lập A",
    "identity_ref": "SYNTHETIC-fictional-not-issuer-evidence",
    "target_evidence": "Công ty Giả Lập A",
    "context": "Công ty Giả Lập A bổ nhiệm giám đốc mới từ tháng tới.",
    "aspect": "leadership_insider",
    "aspect_present": true,
    "sentiment": "neutral",
    "evidence": "bổ nhiệm giám đốc mới từ tháng tới",
    "annotation_status": "verified",
    "review_reason": "",
    "annotator_id": "SYNTHETIC-adjudicator",
    "label_origin": "human",
    "guideline_version": "gold-pilot-v1",
    "dataset_version": "SYNTHETIC-NOT-GOLD-v1",
    "is_synthetic": true,
    "split": "quarantine",
    "review_ids": [
      "SYNTHETIC-review-3-a",
      "SYNTHETIC-review-3-b"
    ],
    "adjudication_id": "SYNTHETIC-decision-3"
  },
  {
    "sample_id": "SYNTHETIC-04:SYN_A:macro_policy",
    "article_id": "SYNTHETIC-04",
    "event_cluster_id": "SYNTHETIC-E04",
    "source": "SYNTHETIC_ONLY",
    "source_url": null,
    "source_revision": "synthetic-v1",
    "source_row_id": "4",
    "license_ref": "SYNTHETIC-invented-not-rights-evidence",
    "article_sha256": "e92b77befc3e3dfb9f8d4e64fcff5c6985908e35457f9e2dff4fb028bbc57574",
    "published_at": null,
    "first_seen_at": null,
    "ticker": "SYN_A",
    "company_name": "Công ty Giả Lập A",
    "identity_ref": "SYNTHETIC-fictional-not-issuer-evidence",
    "target_evidence": "Công ty Giả Lập A",
    "context": "Quy định mới giúp Công ty Giả Lập A giảm chi phí thuế.",
    "aspect": "macro_policy",
    "aspect_present": true,
    "sentiment": "positive",
    "evidence": "Quy định mới giúp Công ty Giả Lập A giảm chi phí thuế",
    "annotation_status": "verified",
    "review_reason": "",
    "annotator_id": "SYNTHETIC-adjudicator",
    "label_origin": "human",
    "guideline_version": "gold-pilot-v1",
    "dataset_version": "SYNTHETIC-NOT-GOLD-v1",
    "is_synthetic": true,
    "split": "quarantine",
    "review_ids": [
      "SYNTHETIC-review-4-a",
      "SYNTHETIC-review-4-b"
    ],
    "adjudication_id": "SYNTHETIC-decision-4"
  },
  {
    "sample_id": "SYNTHETIC-05:SYN_A:capital_structure",
    "article_id": "SYNTHETIC-05",
    "event_cluster_id": "SYNTHETIC-E05",
    "source": "SYNTHETIC_ONLY",
    "source_url": null,
    "source_revision": "synthetic-v1",
    "source_row_id": "5",
    "license_ref": "SYNTHETIC-invented-not-rights-evidence",
    "article_sha256": "9ab98048e4c626e9e82e8875a19840e28a6b2491eb7eb76fb8210a9160c5ac52",
    "published_at": null,
    "first_seen_at": null,
    "ticker": "SYN_A",
    "company_name": "Công ty Giả Lập A",
    "identity_ref": "SYNTHETIC-fictional-not-issuer-evidence",
    "target_evidence": "Công ty Giả Lập A",
    "context": "Công ty Giả Lập A công bố kế hoạch phát hành trái phiếu.",
    "aspect": "capital_structure",
    "aspect_present": true,
    "sentiment": "neutral",
    "evidence": "công bố kế hoạch phát hành trái phiếu",
    "annotation_status": "verified",
    "review_reason": "",
    "annotator_id": "SYNTHETIC-adjudicator",
    "label_origin": "human",
    "guideline_version": "gold-pilot-v1",
    "dataset_version": "SYNTHETIC-NOT-GOLD-v1",
    "is_synthetic": true,
    "split": "quarantine",
    "review_ids": [
      "SYNTHETIC-review-5-a",
      "SYNTHETIC-review-5-b"
    ],
    "adjudication_id": "SYNTHETIC-decision-5"
  },
  {
    "sample_id": "SYNTHETIC-06:SYN_A:legal_esg",
    "article_id": "SYNTHETIC-06",
    "event_cluster_id": "SYNTHETIC-E06",
    "source": "SYNTHETIC_ONLY",
    "source_url": null,
    "source_revision": "synthetic-v1",
    "source_row_id": "6",
    "license_ref": "SYNTHETIC-invented-not-rights-evidence",
    "article_sha256": "c9e29e138cecfbf7d3419ee419549f1d30563bc53b4ee130346e4b4e408dab2b",
    "published_at": null,
    "first_seen_at": null,
    "ticker": "SYN_A",
    "company_name": "Công ty Giả Lập A",
    "identity_ref": "SYNTHETIC-fictional-not-issuer-evidence",
    "target_evidence": "Công ty Giả Lập A",
    "context": "Công ty Giả Lập A bị phạt vì vi phạm công bố thông tin.",
    "aspect": "legal_esg",
    "aspect_present": true,
    "sentiment": "negative",
    "evidence": "bị phạt vì vi phạm công bố thông tin",
    "annotation_status": "verified",
    "review_reason": "",
    "annotator_id": "SYNTHETIC-adjudicator",
    "label_origin": "human",
    "guideline_version": "gold-pilot-v1",
    "dataset_version": "SYNTHETIC-NOT-GOLD-v1",
    "is_synthetic": true,
    "split": "quarantine",
    "review_ids": [
      "SYNTHETIC-review-6-a",
      "SYNTHETIC-review-6-b"
    ],
    "adjudication_id": "SYNTHETIC-decision-6"
  },
  {
    "sample_id": "SYNTHETIC-07:SYN_A:leadership_insider",
    "article_id": "SYNTHETIC-07",
    "event_cluster_id": "SYNTHETIC-E07",
    "source": "SYNTHETIC_ONLY",
    "source_url": null,
    "source_revision": "synthetic-v1",
    "source_row_id": "7",
    "license_ref": "SYNTHETIC-invented-not-rights-evidence",
    "article_sha256": "bbf497c29ba7892fc0190b18bb919f8edb9736aa2a109555c2ee08fedfd5330d",
    "published_at": null,
    "first_seen_at": null,
    "ticker": "SYN_A",
    "company_name": "Công ty Giả Lập A",
    "identity_ref": "SYNTHETIC-fictional-not-issuer-evidence",
    "target_evidence": "Công ty Giả Lập A",
    "context": "Công ty Giả Lập A công bố doanh thu. Văn bản không đề cập lãnh đạo.",
    "aspect": "leadership_insider",
    "aspect_present": false,
    "sentiment": null,
    "evidence": "",
    "annotation_status": "verified",
    "review_reason": "",
    "annotator_id": "SYNTHETIC-adjudicator",
    "label_origin": "human",
    "guideline_version": "gold-pilot-v1",
    "dataset_version": "SYNTHETIC-NOT-GOLD-v1",
    "is_synthetic": true,
    "split": "quarantine",
    "review_ids": [
      "SYNTHETIC-review-7-a",
      "SYNTHETIC-review-7-b"
    ],
    "adjudication_id": "SYNTHETIC-decision-7"
  },
  {
    "sample_id": "SYNTHETIC-08:SYN_A:business_financials",
    "article_id": "SYNTHETIC-08",
    "event_cluster_id": "SYNTHETIC-E08",
    "source": "SYNTHETIC_ONLY",
    "source_url": null,
    "source_revision": "synthetic-v1",
    "source_row_id": "8",
    "license_ref": "SYNTHETIC-invented-not-rights-evidence",
    "article_sha256": "3f372c1bd0f6628be2619d6a86b31667d77d41008d76999c10d53699507e0c97",
    "published_at": null,
    "first_seen_at": null,
    "ticker": "SYN_A",
    "company_name": "Công ty Giả Lập A",
    "identity_ref": "SYNTHETIC-fictional-not-issuer-evidence",
    "target_evidence": "Công ty Giả Lập A",
    "context": "Công ty Giả Lập A tăng doanh thu nhưng lợi nhuận giảm trong cùng kỳ.",
    "aspect": "business_financials",
    "aspect_present": true,
    "sentiment": null,
    "evidence": "tăng doanh thu nhưng lợi nhuận giảm trong cùng kỳ",
    "annotation_status": "needs_review",
    "review_reason": "Mixed operating signals; do not force neutral.",
    "annotator_id": "SYNTHETIC-adjudicator",
    "label_origin": "human",
    "guideline_version": "gold-pilot-v1",